{
 "candidate_id": "TC-3c254582",
 "surface_form": "登録済み会社ドメイン",
 "status": "approved",
 "revision": 9,
 "occurrence_refs": [
  "TO-477b0a60",
  "TO-03734f79",
  "TO-bd920f30"
 ],
 "proposed_term": {
  "id": "RegisteredCompanyDomain",
  "preferred_japanese": "登録済み会社ドメイン",
  "type": "property",
  "definition": "会社マスタに登録済みの会社のドメイン",
  "scope": "project:REQ-DEMO"
 },
 "receipt_id": "APR-TERM-3c254582",
 "review": {
  "reviewer": "usa",
  "decided_at": "2026-08-19T00:00:00+09:00",
  "decision_reason": "案件由来の業務語彙であり組織共通語彙ではない。案件間の同表層衝突をscopeで共存させるため project scope を付与（terminology-lifecycle promotion規約。org:commonへの昇格は2案件以上での使用が条件）"
 }
}